commit	val_bpb	memory_gb	mfu	tok_per_sec	num_steps	num_params_M	batch_size	final_loss	status	description
3087aeb	2.335670	5.5	58.1	37700	180	162.1	4	5.155	keep	baseline (SwiGLU d12 ClimbMix) — BROKEN cooldown: loss 1.50→5.15 during warmdown
81dd182	2.494669	5.5	53.7	33477	167	162.1	4	3.811	discard	constant WD (remove decay) + WARMDOWN_RATIO 0.4→0.3 — warmdown still broken
8da6023	2.141833	5.5	58.1	36982	180	162.1	4	4.950	keep	WARMDOWN_RATIO 0.4→0.0 (no warmdown): loss STILL explodes ~step160 (1.5→5.0) proving instability is NOT warmdown-related but model/optimizer bug
0708cec	2.238187	5.5	53.2	33522	166	162.1	4	3.136	discard	grad clip max_norm=1.0 + WARMDOWN_RATIO=0.4: loss spike reduced (5.0→3.1) but NOT eliminated, clip alone insufficient — need to fix root cause (Q/K weight growth per Moonshot paper)
345ec03	1.832082	5.5	54.9	32782	653	162.1	4	3.235	keep	Hypothesis: smaller batch (2^18→2^16) = more optimizer steps. Evidence: nanochat uses large batch but we have only 180 steps. Result: val_bpb 2.14→1.83 (big win), loss still explodes at ~42M tokens proving data issue not optimizer.
9182733	1.374661	5.5	56.2	35083	665	162.1	4	3.247	keep	Bottleneck: instability at ~42M tokens (loss 0.75→3.2). Hypothesis: ClimbMix sorted by cluster_id causes distribution shift triggering Muon momentum cascade. Shuffling documents within shards randomizes topic order. Evidence: explosion at same token count regardless of batch/warmdown/clip. Result: val_bpb 1.83→1.37 (huge win). NO loss explosion. Training loss 3.25 (vs 0.77 unshuffled) because model can't overfit to single topic cluster. Proves instability was 100% data-ordering.
db01468	1.294054	5.5	54.7	36403	648	162.1	4	3.098	keep	Bottleneck: no LR cooldown (WARMDOWN_RATIO=0.0). Hypothesis: warmdown will now work since data-ordering instability is fixed by shuffle. Evidence: exps 1-3 showed warmdown 'broken' but that was data bug. Exp 6 proved shuffle fixes it. Result: val_bpb 1.37→1.29. Warmdown works perfectly (lrm 1.0→0.0). Training stable throughout. Confirms warmdown was never broken — data ordering was.
cb3cf94	1.282745	5.5	55.4	36076	658	162.1	4	3.165	keep	FINAL_LR_FRAC 0.0→0.1 (hypothesis: Muon docs recommend 0.1x floor not 0 for better final convergence, evidence: Muon GitHub + nanochat): val_bpb 1.294→1.283, 658 steps (vs 648), confirms LR floor helps — model keeps learning during warmdown instead of stalling
1803cd0	1.295032	5.5	54.9	35715	1293	162.1	4	3.265	discard	TOTAL_BATCH_SIZE 2^16→2^15 (hypothesis: halve grad accum 8→4, evidence: exp5 batch reduction helped): val_bpb 1.283→1.295 WORSE. 2x steps (1293) but same total tokens (42M). Smaller batch hurts convergence without improving throughput.
75f1819	1.340624	7.8	55.2	24300	456	226.5	4	3.309	discard	DEPTH 12→14 (768→896 dim, 226M params) (hypothesis: 3GB VRAM headroom → bigger model, evidence: nanochat ratio-8 scaling): val_bpb 1.283→1.341 WORSE. Only 456 steps (vs 658) and 30M tokens (vs 43M) — bigger model processes fewer tokens in 20min. Capacity gain doesn't offset reduced training.
c459e32	1.268992	5.5	58.1	37040	689	162.1	4	3.046	keep	MATRIX_LR 0.03→0.04 (hypothesis: higher Muon LR for faster convergence per step, evidence: modded-nanogpt uses 0.04): val_bpb 1.283→1.269 (0.014 improvement). 689 steps vs 658, stable training throughout. Confirms our LR was suboptimal — modded-nanogpt's 0.04 is better for this scale.
633fd68	1.269490	5.5	57.9	36840	685	162.1	4	3.146	discard	MATRIX_LR 0.04→0.05 (hypothesis: even higher Muon LR for faster convergence, evidence: 0.03→0.04 gave 0.014 improvement): val_bpb 1.269→1.270 — NO improvement (delta 0.0005). 0.04 is near-optimal for this model scale. LR sweep complete: 0.03<0.04≈0.05.
b2e1bcc	1.264656	5.5	57.9	36900	687	162.1	4	3.044	keep	WARMDOWN_RATIO 0.3→0.5 (hypothesis: longer cooldown gives more gradual LR decay for better final convergence, evidence: standard practice for short training): val_bpb 1.269→1.265 (0.004 improvement). With 50% warmdown LR decays earlier (lrm=0.30 at 89%) allowing smoother settling.
756e18c	1.261789	5.5	57.9	36830	687	162.1	4	3.037	keep	WEIGHT_DECAY 0.2→0.1 (hypothesis: less regularization helps since model underfits with final_loss=3.04, evidence: short training unlikely to overfit): val_bpb 1.265→1.262 (0.003 improvement). Lower WD lets weights grow faster, better convergence in limited steps.
e5ec918	1.265620	5.5	57.6	36648	683	162.1	4	3.099	discard	EMBEDDING_LR 0.4→0.6 (hypothesis: embeddings are 47% of params and undertrained in 687 steps; higher LR accelerates convergence; evidence: landscape scan): val_bpb 1.262→1.266 WORSE. 0.6 overshoots — 0.4 is near-optimal for embedding LR.
7b1c5a1	0.000000	0.0	0.0	0	0	0.0	0	0.000	crash	weight tying (lm_head.weight=wte.weight): loss stuck at 10.82 — shared weight gets embedding LR 0.4 which is 100x too high for output projection role; need separate LR scaling or different tying approach
6b14356	1.278175	5.5	57.6	36638	682	162.1	4	3.096	discard	UNEMBEDDING_LR 0.004→0.02 (hypothesis: lm_head 24% of params undertrained at low LR; 5x increase should improve output projection learning; evidence: weight tying crash proved 0.4 too high so 0.02 conservative): val_bpb 1.262→1.278 WORSE. Higher unembedding LR overshoots — 0.004 is near-optimal for separate lm_head.
dc5db03	1.318778	5.5	56.6	36081	672	162.1	4	3.198	discard	ReLU² MLP instead of SwiGLU (hypothesis: 2 larger matmuls better GPU utilization than 3 smaller; evidence: modded-nanogpt leaders use ReLU²): val_bpb 1.262→1.319 MUCH WORSE. SwiGLU's gated activation is clearly superior at this scale/budget. ReLU² lacks the gating mechanism that helps SwiGLU converge faster.
6d75a72	1.265325	5.5	57.9	36727	686	162.1	4	3.117	discard	Muon NS iterations 5→4 (hypothesis: fewer orthogonalization steps save compute per Turbo-Muon paper; evidence: arxiv 2512.04632): val_bpb 1.262→1.265 WORSE (delta 0.004). Optimization quality degraded — 4 NS steps insufficient without AOL preconditioner. Need full Turbo-Muon implementation not just fewer steps.
aaf9a1f	1.269199	5.5	57.9	37063	685	162.1	4	3.121	discard	WARMUP_RATIO 0.05→0.02 (hypothesis: shorter warmup gives 20 more steps at full LR; evidence: QK-Norm + softcap stabilize early training): val_bpb 1.262→1.269 WORSE. Shorter warmup causes early gradient noise that hurts learning — 5% warmup (34 steps) is needed for stable ramp-up even with QK-Norm.
620a7a7	1.233397	7.0	51.7	35300	652	200.7	4	2.930	keep	value embeddings: shared nn.Embedding(50257x768) added to attention values at all 12 layers (hypothesis: adds 38.6M 'free FLOP' params using 3GB VRAM headroom for direct token→value path; evidence: modded-nanogpt VE set world record): val_bpb 1.262→1.233 (0.028 improvement). MFU 58→52% (embedding lookup overhead) but capacity gain dominates. 200.7M params vs 162.1M. Confirms VE adds complementary capacity to x0 skip connections.
b46cc9e	1.229346	7.0	53.0	35900	670	200.7	4	2.913	keep	cosine warmdown instead of linear (hypothesis: cosine keeps LR higher during early warmdown for more learning per step; evidence: cosine widely adopted in GPT-3/LLaMA/Chinchilla): val_bpb 1.233→1.229 (0.004 improvement). 670 steps vs 652 (cosine maintains higher LR longer → more effective steps). Confirms cosine > linear for warmdown.
7e681dd	1.229203	7.0	53.2	36100	670	200.7	4	2.909	discard	WARMDOWN_RATIO 0.5→0.6 + autotune refresh with expanded batch candidates (hypothesis: longer cosine cooldown improves convergence; evidence: 0.3→0.5 helped by 0.004): val_bpb 1.229→1.229 NO improvement (delta <0.001). Autotune still chose batch_size=4. 0.5 is near-optimal warmdown ratio — further increase gives diminishing returns.
9a8eaa3	1.253550	7.0	52.3	35247	647	200.7	4	3.080	discard	U-Net skip connections with sigmoid gating (layer 0→11, 1→10, etc., init -1.5 sigmoid≈0.18) (hypothesis: skip connections improve gradient flow/feature reuse at zero compute cost; evidence: modded-nanogpt leaderboard): val_bpb 1.229→1.254 WORSE. Skip connections interfered with existing x0 residual stream — two skip mechanisms compete rather than complement. The x0 lambdas already provide global gradient shortcuts; U-Net skips add redundant paths that dilute learned representations.
6a39bd5	1.245229	8.2	49.3	32596	606	239.3	4	3.090	discard	2 VE groups (layers 0-5 share VE1, layers 6-11 share VE2) instead of 1 shared VE (hypothesis: separate VE modules let early/late layers specialize different token→value mappings using 2.4GB VRAM headroom; evidence: modded-nanogpt uses multiple VE groups): val_bpb 1.229→1.245 WORSE. 239M params (+39M) but MFU dropped 53→49% and steps 670→606 (-10%). Extra VE embedding lookups are bandwidth-bound, slowing each step. The capacity gain from VE specialization doesn't offset losing 64 optimizer steps.
fa89372	1.234214	7.0	57.4	35176	655	200.7	4	3.003	discard	z-loss regularization 1e-4*logits^2.mean() (hypothesis: prevents logit drift for better convergence at zero throughput cost; evidence: PaLM/Gemma use z-loss): val_bpb 1.229→1.234 WORSE (delta +0.005). MFU 57.4% (good — no overhead). z-loss is redundant with softcap=30 which already bounds logits to [-30,30]. The extra gradient from z-loss slightly hurts optimization without providing new signal.
f6afe08	1.296943	7.0	56.9	34228	642	200.7	4	3.183	discard	HEAD_DIM 128→64 (6 heads→12 heads) (hypothesis: more attention heads = more diverse patterns at same FLOPs; evidence: SOTA small models use HEAD_DIM=64): val_bpb 1.229→1.297 MUCH WORSE. Smaller head dim reduces per-head capacity too much — 128-dim heads better capture position/semantic info via RoPE at 768 dim. More heads ≠ better at this scale.
0368d59	1.264137	7.0	53.7	35165	621	200.7	4	3.238	discard	parallel attn+MLP (PaLM-style: x = x + attn(norm(x)) + mlp(norm(x))) (hypothesis: both branches see same input enabling independent specialization + saves one norm per layer; evidence: PaLM/GPT-J use this): val_bpb 1.229→1.264 WORSE. Sequential residuals let MLP refine attention output which is critical — parallel blocks lose this sequential refinement at our scale.
edee52e	1.217980	7.0	53.0	35567	659	200.7	4	3.079	keep	softcap 30→15 (hypothesis: tighter logit cap provides stronger gradient signal near boundary for faster convergence + implicit regularization; evidence: karpathy/autoresearch uses softcap=15): val_bpb 1.229→1.218 (0.011 improvement). 659 steps vs 670 similar throughput. Confirms softcap=30 was too permissive — 15 better constrains logit range for 50K vocab.
